{"assertion_results":[{"assertion_id":"telemetry-ready","observed_value":1,"source":"core","status":"passed","unit":"count"}],"authorization":{"execution_verification_sha256":"c40d98d2ecfab5a814862cc4a428818b006c98d4f76cfde50ac2f6a01e9ff74a","mode":"verified_execution_permit","permit_sha256":"6317d89ac170d7ee14b17a855423fd0f1a7efb5f622763b91e3649c2e2727474","target":{"environment":"hil","identity_kind":"mavlink_system_component","identity_sha256":"eeeeeeeeeeeeeeeeeeeeeeeeeeeeeeeeeeeeeeeeeeeeeeeeeeeeeeeeeeeeeeee","target_id":"controller-alpha"},"trust_policy_sha256":"ebf641b9736cfbb450ff34ca3068ddb5130669496993c41319d0760971c65b76"},"clock_observation":{"deadline_miss_ratio":0,"drift_ppm":2,"monotonic":true,"offset_ms":0.5,"real_time_factor":1},"domain_id":"controller-domain","evaluation_mode":"live","evaluators":[],"evidence":[{"artifact_id":"artifact-0","kind":"observation","media_type":"application/json","retention_class":"hil-30d","segment_index":0,"sha256":"73b2d93497d7b063c8ee198a73d73e26f265bfd380b41393ca9d2f12f41dd32a","size_bytes":32,"uri":"file:///evidence/hardware-clock.json"},{"artifact_id":"artifact-1","kind":"recording","media_type":"application/mcap","retention_class":"hil-30d","segment_index":1,"sha256":"1badcdad7b9ef8b51ac152345aed8a5692202d78e6f0cb27540a0ab7775a82cb","size_bytes":34,"uri":"file:///evidence/observation.mcap"}],"execution":{"data_plane_profile":"secure_shared_memory","data_source":"live_target","plant_backend":"real_hardware","target_environment":"hil","time_mode":"hardware_realtime"},"finished_at":"2026-07-12T10:02:00Z","forbidden_graph_observation":{"checked_actions":[],"checked_services":[],"checked_topics":["/cmd_vel"],"passed":true,"violations":[]},"hardware_clock_observation":{"drift_ppm":2,"evidence_sha256":"73b2d93497d7b063c8ee198a73d73e26f265bfd380b41393ca9d2f12f41dd32a","jitter_ms":0.2,"max_sample_age_ms":10,"measured_at":"2026-07-12T10:01:00Z","offset_ms":0.5,"sample_count":120,"source":"mavlink_timesync_status","sync_protocol":"mavlink_timesync","within_policy":true},"lifecycle_states":[],"monotonic_duration_sec":120,"observed_ros_graph":{"actions":[],"services":[],"stable_for_sec":3,"topics":[{"first_message_at_ns":1000000000,"name":"/telemetry/state","publishers":1,"subscribers":1,"type":"example_msgs/msg/State"}]},"result_id":"result-41234567-89ab-4def-8123-456789abcdef","run_id":"run-41234567-89ab-4def-8123-456789abcdef","runtime_manifest_sha256":"228a82ea8570be357de61051e360ab6780bd1d8c2c97de3646fb56dcf57d0f06","runtime_observation":{"execution_subject_digest":"sha256:aaaaaaaaaaaaaaaaaaaaaaaaaaaaaaaaaaaaaaaaaaaaaaaaaaaaaaaaaaaaaaaa","rmw_implementation":"rmw_fastrtps_cpp","rmw_version":"0.0.0-fixture","ros_domain_id":42,"security_enabled":true,"security_strategy":"Enforce"},"scenario_id":"org.example.controller-hil-observation","scenario_sha256":"6648c69bb1e0058c6ba233fa0003c7da4e1a4b898ef2aca543d2104ead133fab","schema_version":"acceptance-result.v1","shutdown":{"evidence_index_finalized":true,"observer_detached":true,"recorders_closed":true},"started_at":"2026-07-12T10:00:00Z","status":"passed","time_authority_observation":{"evidence_sha256":"73b2d93497d7b063c8ee198a73d73e26f265bfd380b41393ca9d2f12f41dd32a","max_delivery_latency_ms":2,"p50_delivery_latency_ms":0.5,"p95_delivery_latency_ms":1,"sample_count":120,"source_id":"controller-clock","window_end_ns":120,"window_start_ns":1,"within_policy":true},"unevaluated":[],"verdict_scope":"domain","workload":{"kind":"none"}}
