{"assertion_results":[{"assertion_id":"camera-age","observed_value":20.1,"source":"core","status":"passed","unit":"ms"}],"authorization":{"mode":"none"},"clock_observation":{"deadline_miss_ratio":0,"drift_ppm":0,"monotonic":true,"offset_ms":0,"real_time_factor":0.99},"domain_id":"control","evaluation_mode":"live","evaluators":[],"evidence":[{"artifact_id":"artifact-0","kind":"recording","media_type":"application/mcap","retention_class":"pull-request-7d","segment_index":0,"sha256":"f4fe82e98d662edf14ad4c1d770bc391096715a0766d86a6b6ff9214f8b85ce6","size_bytes":25,"uri":"file:///evidence/control.mcap"},{"artifact_id":"artifact-1","kind":"trace","media_type":"application/x-ndjson","retention_class":"pull-request-7d","segment_index":3,"sha256":"52fe4379e143aa73a0e8f4231bd2e2978c44a02f3672ccab063c87b0d586b45b","size_bytes":73,"uri":"file:///evidence/control.otlp.jsonl"}],"execution":{"data_plane_profile":"standard_isolated","data_source":"simulator","plant_backend":"simulated_physics","target_environment":"simulation","time_mode":"simulation_realtime"},"finished_at":"2026-07-11T12:02:00Z","forbidden_graph_observation":{"checked_actions":[],"checked_services":[],"checked_topics":[],"passed":true,"violations":[]},"lifecycle_states":[],"monotonic_duration_sec":120,"observed_ros_graph":{"actions":[],"services":[],"stable_for_sec":3,"topics":[{"first_message_at_ns":1000000000,"name":"/camera/image","publishers":1,"subscribers":1,"type":"sensor_msgs/msg/Image"}]},"result_id":"result-00000000-0000-4000-8000-000000000001","run_id":"run-00000000-0000-4000-8000-000000000001","runtime_manifest_sha256":"363b85097ae650a75cf5d69463152c8d87ca7adebaf6b89b0d3a4737f416f076","runtime_observation":{"execution_subject_digest":"sha256:aaaaaaaaaaaaaaaaaaaaaaaaaaaaaaaaaaaaaaaaaaaaaaaaaaaaaaaaaaaaaaaa","rmw_implementation":"rmw_fastrtps_cpp","rmw_version":"0.0.0-fixture","ros_domain_id":42,"security_enabled":false,"security_strategy":"none"},"scenario_id":"org.example.camera-stream","scenario_sha256":"49e37875bf6c26f3b2c6ada6c3ed45b51d879843eefbaefba09c90dd000b0626","schema_version":"acceptance-result.v1","shutdown":{"evidence_index_finalized":true,"observer_detached":true,"recorders_closed":true},"started_at":"2026-07-11T12:00:00Z","status":"passed","time_authority_observation":{"evidence_sha256":"52fe4379e143aa73a0e8f4231bd2e2978c44a02f3672ccab063c87b0d586b45b","max_delivery_latency_ms":0.3,"p50_delivery_latency_ms":0.1,"p95_delivery_latency_ms":0.2,"sample_count":30,"source_id":"simulator-clock","window_end_ns":30,"window_start_ns":1,"within_policy":true},"unevaluated":[],"verdict_scope":"domain","workload":{"kind":"none"}}
