{"assertion_results":[{"assertion_id":"camera-age","observed_value":20.1,"source":"core","status":"passed","unit":"ms"}],"authorization":{"mode":"none"},"clock_observation":{"deadline_miss_ratio":0,"drift_ppm":0,"monotonic":true,"offset_ms":0,"real_time_factor":0.99},"dataset_manifest_sha256":"89240213fea3f8862bdf223b6fd01855d9ff49cac9d1d976f8e21ba61c4fc684","domain_id":"primary","evaluation_mode":"live","evaluators":[{"artifact_sha256":"a9f3c61cefdc82ae15ea38847921437b5bf521d6d5a05171226284fe597e7210","distribution":"example-evaluator","entry_point":"example_evaluator:evaluate","namespace":"org.example.vision","receipt_sha256":"7284e73fe06ddba1b0286c53b41eb364459f8dbb1ce0ca5f60077627f38d0258","version":"1.0.0"}],"evidence":[{"artifact_id":"artifact-0","immutable_revision":"version-id:fixture-v1","kind":"recording","media_type":"application/mcap","receipt_sha256":"9de0a9f5fdc1808ed803c132e5070827c6865b504b25ba10bf6abd8a73e391ae","retention_class":"pull-request-7d","segment_index":0,"sha256":"b55b1327d97412b150ada1a77be869545eb65bb65db52d0d69e6e6a5fb5138de","size_bytes":30,"uri":"s3://robotics-fixture/run-10000000-0000-4000-8000-000000000001/output.mcap?versionId=fixture-v1"}],"execution":{"data_plane_profile":"standard_isolated","data_source":"simulator","plant_backend":"simulated_physics","target_environment":"simulation","time_mode":"simulation_realtime"},"finished_at":"2026-07-11T12:02:00Z","forbidden_graph_observation":{"checked_actions":[],"checked_services":[],"checked_topics":[],"passed":true,"violations":[]},"lifecycle_states":[],"model_manifest_sha256":"026ed9af4bb1eb4ed07868acee4d8a5e66aa38767e2f9de5b2eb1b563c1764a5","monotonic_duration_sec":120,"observed_ros_graph":{"actions":[],"services":[],"stable_for_sec":3,"topics":[{"first_message_at_ns":1000000000,"name":"/camera/image","publishers":1,"subscribers":1,"type":"sensor_msgs/msg/Image"}]},"result_id":"result-01234567-89ab-4def-8123-456789abcdef","run_id":"run-10000000-0000-4000-8000-000000000001","runtime_manifest_sha256":"6f796b2fd0e933825201f10b8ef3adc32410bd56bc4619590a2bea627b366e43","runtime_observation":{"execution_subject_digest":"sha256:aaaaaaaaaaaaaaaaaaaaaaaaaaaaaaaaaaaaaaaaaaaaaaaaaaaaaaaaaaaaaaaa","rmw_implementation":"rmw_fastrtps_cpp","rmw_version":"0.0.0-fixture","ros_domain_id":42,"security_enabled":false,"security_strategy":"none"},"scenario_id":"org.example.camera-stream","scenario_sha256":"9ed90d21bf272c4082211cbe42dc39fe0a7178b1a59d8b1a43bf93dc54acca3f","schema_version":"acceptance-result.v1","shutdown":{"evidence_index_finalized":true,"observer_detached":true,"recorders_closed":true},"started_at":"2026-07-11T12:00:00Z","status":"passed","time_authority_observation":{"evidence_sha256":"b55b1327d97412b150ada1a77be869545eb65bb65db52d0d69e6e6a5fb5138de","max_delivery_latency_ms":0.3,"p50_delivery_latency_ms":0.1,"p95_delivery_latency_ms":0.2,"sample_count":30,"source_id":"simulator-clock","window_end_ns":30,"window_start_ns":1,"within_policy":true},"unevaluated":[],"verdict_scope":"domain","workload":{"actual_provider":"CPUExecutionProvider","fallback_count":0,"kind":"inference","model_format":"onnx","runtime_family":"onnxruntime_cpu"}}
